Sheet,Description,Source,Contact Information,Data Update Schedule
Case Information,List of confirmed COVID-19 cases from the DOH Epidemiological Bureau.,DOH - Epidemiology Bureau,covidtracker@doh.gov.ph,Daily at 4PM
DOH Data Collect - Daily Report,Self-reported inventories for the day from hospitals on COVID19-dedicated beds and mechanical ventilators,"Collated by DOH, self-reported by hospitals",covidtracker@doh.gov.ph,Daily at 4PM
DOH Data Collect - Weekly Report,Self-reported inventories from hospitals on inventory of personal protective equipment (PPE) and medical personnel. Updated on a weekly basis by hospitals,"Collated by DOH, self-reported by hospitals",covidtracker@doh.gov.ph,Daily at 4PM
Testing Aggregates,,DOH,covidtracker@doh.gov.ph,Daily at 4PM
Privacy Notice,,-,-,-
